{
  "schemaVersion": 1,
  "documentType": "actionclip.marketplace.action-definition",
  "catalogRevision": "2026-08-21.1",
  "publishedAt": "2026-08-20T18:50:00Z",
  "action": {
    "category": "productivity",
    "details": "Opens Wikipedia’s search results for the exact selection instead of assuming a matching article title exists.",
    "exampleInput": "local-first software",
    "exampleOutput": "English Wikipedia opens with matching article results.",
    "icon": "fluent:book-open-24-regular",
    "id": "510A0C00-0046-4D9A-A001-000000000046",
    "name": "Search Wikipedia",
    "outputMode": "opens_externally",
    "privacyKind": "online",
    "privacySummary": "The selected text is sent to en.wikipedia.org as part of the URL when you run the action.",
    "requirements": "Online Actions must be enabled.",
    "summary": "Search English Wikipedia for the selected text.",
    "template": "https://en.wikipedia.org/w/index.php?search={{url_encoded__selected_text}}",
    "type": "url"
  }
}
