{
  "schemaVersion": 1,
  "documentType": "actionclip.marketplace.action-definition",
  "catalogRevision": "2026-08-21.1",
  "publishedAt": "2026-08-20T18:50:00Z",
  "action": {
    "category": "appIntegrations",
    "details": "Reproduces Fluent's generated PopClip action by sending the selected text and Fluent action identifier simplifyELI5 through the FLNT/ACTN Apple event.",
    "exampleInput": "A technical explanation of public-key cryptography.",
    "exampleOutput": "Fluent runs Explain Like I'm 5 on the selected text.",
    "icon": "fluent:emoji-24-regular",
    "id": "510A0C00-0060-4D9A-A001-000000000060",
    "integration": {
      "appIcon": "fluent-app",
      "icon": "fluent:apps-24-regular",
      "id": "fluent",
      "name": "Fluent",
      "summary": "AI writing, translation, and editing actions powered by Fluent."
    },
    "name": "Fluent — Explain Like I'm 5",
    "outputMode": "opens_externally",
    "privacyKind": "externalApp",
    "privacySummary": "ActionClip passes the selected text to Fluent on this Mac. Fluent then uses the local or cloud model configured in Fluent.",
    "requirements": "Fluent 1.7.1 or later must be installed and the corresponding built-in Fluent action must be available. macOS may ask you to allow ActionClip to control Fluent.",
    "summary": "Explain the selected text in simple terms using Fluent.",
    "template": "tell application id \"net.epicbits.FluentStandalone\"\n    «event FLNTACTN» {\"simplifyELI5\", \"{{selected_text}}\"}\nend tell",
    "type": "apple_script"
  }
}
