{
  "schemaVersion": 1,
  "documentType": "actionclip.marketplace.action-definition",
  "catalogRevision": "2026-08-21.1",
  "publishedAt": "2026-08-20T18:50:00Z",
  "action": {
    "category": "developerTools",
    "details": "Uses JavaScript’s encodeURIComponent behavior so reserved query and path characters cannot change URL structure.",
    "exampleInput": "push / pull?",
    "exampleOutput": "push%20%2F%20pull%3F",
    "icon": "fluent:lock-closed-24-regular",
    "id": "510A0C00-0024-4D9A-A001-000000000024",
    "name": "URL Encode",
    "outputMode": "text_replaceable",
    "privacyKind": "onDevice",
    "privacySummary": "Runs locally in ActionClip’s JavaScript sandbox. Selected text does not leave your Mac.",
    "requirements": "No setup required.",
    "summary": "Percent-encode selected text as a URL component.",
    "template": "function run(selected_text) {\n  return encodeURIComponent(selected_text);\n}",
    "type": "javascript"
  }
}
